{
  "version": 2,
  "command": "facts",
  "module": "record_update",
  "identity_scheme": "nauqtype.semantic.v1",
  "summary": {
    "modules": 1,
    "definitions": 9,
    "references": 20,
    "call_edges": 1
  },
  "modules": [
    {
      "id": "module:record_update",
      "name": "record_update"
    }
  ],
  "definitions": [
    {
      "id": "type:record_update::Point",
      "kind": "type",
      "module": "record_update",
      "name": "Point",
      "public": false,
      "evidence": "declared",
      "span": { "start": 5 }
    },
    {
      "id": "fn:record_update::shift_x",
      "kind": "function",
      "module": "record_update",
      "name": "shift_x",
      "public": false,
      "evidence": "declared",
      "span": { "start": 43 }
    },
    {
      "id": "fn:record_update::main",
      "kind": "function",
      "module": "record_update",
      "name": "main",
      "public": false,
      "evidence": "declared",
      "span": { "start": 139 }
    },
    {
      "id": "field:record_update::Point::x",
      "kind": "field",
      "module": "record_update",
      "owner": "type:record_update::Point",
      "name": "x",
      "type": "i32",
      "evidence": "declared",
      "span": { "start": 17 }
    },
    {
      "id": "field:record_update::Point::y",
      "kind": "field",
      "module": "record_update",
      "owner": "type:record_update::Point",
      "name": "y",
      "type": "i32",
      "evidence": "declared",
      "span": { "start": 29 }
    },
    {
      "id": "binding:fn:record_update::shift_x:1:point@51",
      "kind": "param",
      "module": "record_update",
      "owner": "fn:record_update::shift_x",
      "name": "point",
      "scope_id": 1,
      "evidence": "checked",
      "span": { "start": 51 }
    },
    {
      "id": "binding:fn:record_update::shift_x:1:next_x@65",
      "kind": "param",
      "module": "record_update",
      "owner": "fn:record_update::shift_x",
      "name": "next_x",
      "scope_id": 1,
      "evidence": "checked",
      "span": { "start": 65 }
    },
    {
      "id": "binding:fn:record_update::main:1:start@163",
      "kind": "local",
      "module": "record_update",
      "owner": "fn:record_update::main",
      "name": "start",
      "scope_id": 1,
      "evidence": "checked",
      "span": { "start": 163 }
    },
    {
      "id": "binding:fn:record_update::main:1:moved@202",
      "kind": "local",
      "module": "record_update",
      "owner": "fn:record_update::main",
      "name": "moved",
      "scope_id": 1,
      "evidence": "checked",
      "span": { "start": 202 }
    }
  ],
  "references": [
    {
      "id": "typeref:record_update::Point@20",
      "kind": "field_type",
      "from": "Point",
      "name": "i32",
      "target_kind": "builtin_type",
      "target_id": "builtin-type:i32",
      "evidence": "builtin",
      "span": { "start": 20 }
    },
    {
      "id": "typeref:record_update::Point@32",
      "kind": "field_type",
      "from": "Point",
      "name": "i32",
      "target_kind": "builtin_type",
      "target_id": "builtin-type:i32",
      "evidence": "builtin",
      "span": { "start": 32 }
    },
    {
      "id": "typeref:record_update::shift_x@58",
      "kind": "param_type",
      "from": "shift_x",
      "name": "Point",
      "target_kind": "type",
      "target_id": "type:record_update::Point",
      "evidence": "checked",
      "span": { "start": 58 }
    },
    {
      "id": "typeref:record_update::shift_x@73",
      "kind": "param_type",
      "from": "shift_x",
      "name": "i32",
      "target_kind": "builtin_type",
      "target_id": "builtin-type:i32",
      "evidence": "builtin",
      "span": { "start": 73 }
    },
    {
      "id": "typeref:record_update::shift_x@81",
      "kind": "return_type",
      "from": "shift_x",
      "name": "Point",
      "target_kind": "type",
      "target_id": "type:record_update::Point",
      "evidence": "checked",
      "span": { "start": 81 }
    },
    {
      "id": "typeref:record_update::main@149",
      "kind": "return_type",
      "from": "main",
      "name": "i32",
      "target_kind": "builtin_type",
      "target_id": "builtin-type:i32",
      "evidence": "builtin",
      "span": { "start": 149 }
    },
    {
      "id": "nameref:record_update::shift_x@100",
      "kind": "struct_type",
      "from": "fn:record_update::shift_x",
      "name": "Point",
      "target_kind": "type",
      "target_id": "type:record_update::Point",
      "evidence": "checked",
      "span": { "start": 100 }
    },
    {
      "id": "nameref:record_update::shift_x@113",
      "kind": "value",
      "from": "fn:record_update::shift_x",
      "name": "point",
      "target_kind": "binding",
      "target_id": "binding:fn:record_update::shift_x:1:point@51",
      "evidence": "checked",
      "span": { "start": 113 }
    },
    {
      "id": "nameref:record_update::shift_x@123",
      "kind": "value",
      "from": "fn:record_update::shift_x",
      "name": "next_x",
      "target_kind": "binding",
      "target_id": "binding:fn:record_update::shift_x:1:next_x@65",
      "evidence": "checked",
      "span": { "start": 123 }
    },
    {
      "id": "nameref:record_update::main@171",
      "kind": "struct_type",
      "from": "fn:record_update::main",
      "name": "Point",
      "target_kind": "type",
      "target_id": "type:record_update::Point",
      "evidence": "checked",
      "span": { "start": 171 }
    },
    {
      "id": "nameref:record_update::main@210",
      "kind": "call",
      "from": "fn:record_update::main",
      "name": "shift_x",
      "target_kind": "function",
      "target_id": "fn:record_update::shift_x",
      "evidence": "checked",
      "span": { "start": 210 }
    },
    {
      "id": "nameref:record_update::main@218",
      "kind": "value",
      "from": "fn:record_update::main",
      "name": "start",
      "target_kind": "binding",
      "target_id": "binding:fn:record_update::main:1:start@163",
      "evidence": "checked",
      "span": { "start": 218 }
    },
    {
      "id": "nameref:record_update::main@241",
      "kind": "value",
      "from": "fn:record_update::main",
      "name": "moved",
      "target_kind": "binding",
      "target_id": "binding:fn:record_update::main:1:moved@202",
      "evidence": "checked",
      "span": { "start": 241 }
    },
    {
      "id": "nameref:record_update::main@251",
      "kind": "value",
      "from": "fn:record_update::main",
      "name": "moved",
      "target_kind": "binding",
      "target_id": "binding:fn:record_update::main:1:moved@202",
      "evidence": "checked",
      "span": { "start": 251 }
    },
    {
      "id": "fieldref:field_access:record_update::main@247",
      "kind": "field_access",
      "from": "fn:record_update::main",
      "name": "x",
      "target_kind": "field",
      "target_id": "field:record_update::Point::x",
      "evidence": "checked",
      "span": { "start": 247 }
    },
    {
      "id": "fieldref:field_access:record_update::main@257",
      "kind": "field_access",
      "from": "fn:record_update::main",
      "name": "y",
      "target_kind": "field",
      "target_id": "field:record_update::Point::y",
      "evidence": "checked",
      "span": { "start": 257 }
    },
    {
      "id": "fieldref:field_init:record_update::shift_x@120",
      "kind": "field_init",
      "from": "fn:record_update::shift_x",
      "name": "x",
      "target_kind": "field",
      "target_id": "field:record_update::Point::x",
      "evidence": "checked",
      "span": { "start": 120 }
    },
    {
      "id": "fieldref:record_update_inherit:record_update::shift_x@113",
      "kind": "record_update_inherit",
      "from": "fn:record_update::shift_x",
      "name": "y",
      "target_kind": "field",
      "target_id": "field:record_update::Point::y",
      "evidence": "checked",
      "span": { "start": 113 }
    },
    {
      "id": "fieldref:field_init:record_update::main@179",
      "kind": "field_init",
      "from": "fn:record_update::main",
      "name": "x",
      "target_kind": "field",
      "target_id": "field:record_update::Point::x",
      "evidence": "checked",
      "span": { "start": 179 }
    },
    {
      "id": "fieldref:field_init:record_update::main@185",
      "kind": "field_init",
      "from": "fn:record_update::main",
      "name": "y",
      "target_kind": "field",
      "target_id": "field:record_update::Point::y",
      "evidence": "checked",
      "span": { "start": 185 }
    }
  ],
  "call_graph": [
    {
      "caller": "fn:record_update::main",
      "callee": "fn:record_update::shift_x",
      "call_site": "call:record_update::main@210",
      "evidence": "checked"
    }
  ]
}
