{
  "version": 2,
  "command": "facts",
  "module": "named_args_main",
  "identity_scheme": "nauqtype.semantic.v1",
  "summary": {
    "modules": 2,
    "definitions": 9,
    "references": 22,
    "call_edges": 2
  },
  "modules": [
    {
      "id": "module:named_args_helper",
      "name": "named_args_helper"
    },
    {
      "id": "module:named_args_main",
      "name": "named_args_main"
    }
  ],
  "definitions": [
    {
      "id": "fn:named_args_helper::combine",
      "kind": "function",
      "module": "named_args_helper",
      "name": "combine",
      "public": true,
      "evidence": "declared",
      "span": { "start": 7 }
    },
    {
      "id": "fn:named_args_main::local",
      "kind": "function",
      "module": "named_args_main",
      "name": "local",
      "public": false,
      "evidence": "declared",
      "span": { "start": 27 }
    },
    {
      "id": "fn:named_args_main::main",
      "kind": "function",
      "module": "named_args_main",
      "name": "main",
      "public": false,
      "evidence": "declared",
      "span": { "start": 96 }
    },
    {
      "id": "binding:fn:named_args_helper::combine:1:left@15",
      "kind": "param",
      "module": "named_args_helper",
      "owner": "fn:named_args_helper::combine",
      "name": "left",
      "scope_id": 1,
      "evidence": "checked",
      "span": { "start": 15 }
    },
    {
      "id": "binding:fn:named_args_helper::combine:1:right@26",
      "kind": "param",
      "module": "named_args_helper",
      "owner": "fn:named_args_helper::combine",
      "name": "right",
      "scope_id": 1,
      "evidence": "checked",
      "span": { "start": 26 }
    },
    {
      "id": "binding:fn:named_args_helper::combine:1:scale@38",
      "kind": "param",
      "module": "named_args_helper",
      "owner": "fn:named_args_helper::combine",
      "name": "scale",
      "scope_id": 1,
      "evidence": "checked",
      "span": { "start": 38 }
    },
    {
      "id": "binding:fn:named_args_main::local:1:left@33",
      "kind": "param",
      "module": "named_args_main",
      "owner": "fn:named_args_main::local",
      "name": "left",
      "scope_id": 1,
      "evidence": "checked",
      "span": { "start": 33 }
    },
    {
      "id": "binding:fn:named_args_main::local:1:right@44",
      "kind": "param",
      "module": "named_args_main",
      "owner": "fn:named_args_main::local",
      "name": "right",
      "scope_id": 1,
      "evidence": "checked",
      "span": { "start": 44 }
    },
    {
      "id": "binding:fn:named_args_main::main:1:subtotal@120",
      "kind": "local",
      "module": "named_args_main",
      "owner": "fn:named_args_main::main",
      "name": "subtotal",
      "scope_id": 1,
      "evidence": "checked",
      "span": { "start": 120 }
    }
  ],
  "references": [
    {
      "id": "use:named_args_main->named_args_helper@4",
      "kind": "import",
      "from": "module:named_args_main",
      "name": "named_args_helper",
      "target_kind": "module",
      "target_id": "module:named_args_helper",
      "evidence": "declared",
      "span": { "start": 4 }
    },
    {
      "id": "typeref:named_args_helper::combine@21",
      "kind": "param_type",
      "from": "combine",
      "name": "i32",
      "target_kind": "builtin_type",
      "target_id": "builtin-type:i32",
      "evidence": "builtin",
      "span": { "start": 21 }
    },
    {
      "id": "typeref:named_args_helper::combine@33",
      "kind": "param_type",
      "from": "combine",
      "name": "i32",
      "target_kind": "builtin_type",
      "target_id": "builtin-type:i32",
      "evidence": "builtin",
      "span": { "start": 33 }
    },
    {
      "id": "typeref:named_args_helper::combine@45",
      "kind": "param_type",
      "from": "combine",
      "name": "i32",
      "target_kind": "builtin_type",
      "target_id": "builtin-type:i32",
      "evidence": "builtin",
      "span": { "start": 45 }
    },
    {
      "id": "typeref:named_args_helper::combine@53",
      "kind": "return_type",
      "from": "combine",
      "name": "i32",
      "target_kind": "builtin_type",
      "target_id": "builtin-type:i32",
      "evidence": "builtin",
      "span": { "start": 53 }
    },
    {
      "id": "typeref:named_args_main::local@39",
      "kind": "param_type",
      "from": "local",
      "name": "i32",
      "target_kind": "builtin_type",
      "target_id": "builtin-type:i32",
      "evidence": "builtin",
      "span": { "start": 39 }
    },
    {
      "id": "typeref:named_args_main::local@51",
      "kind": "param_type",
      "from": "local",
      "name": "i32",
      "target_kind": "builtin_type",
      "target_id": "builtin-type:i32",
      "evidence": "builtin",
      "span": { "start": 51 }
    },
    {
      "id": "typeref:named_args_main::local@59",
      "kind": "return_type",
      "from": "local",
      "name": "i32",
      "target_kind": "builtin_type",
      "target_id": "builtin-type:i32",
      "evidence": "builtin",
      "span": { "start": 59 }
    },
    {
      "id": "typeref:named_args_main::main@106",
      "kind": "return_type",
      "from": "main",
      "name": "i32",
      "target_kind": "builtin_type",
      "target_id": "builtin-type:i32",
      "evidence": "builtin",
      "span": { "start": 106 }
    },
    {
      "id": "nameref:named_args_helper::combine@71",
      "kind": "value",
      "from": "fn:named_args_helper::combine",
      "name": "left",
      "target_kind": "binding",
      "target_id": "binding:fn:named_args_helper::combine:1:left@15",
      "evidence": "checked",
      "span": { "start": 71 }
    },
    {
      "id": "nameref:named_args_helper::combine@78",
      "kind": "value",
      "from": "fn:named_args_helper::combine",
      "name": "right",
      "target_kind": "binding",
      "target_id": "binding:fn:named_args_helper::combine:1:right@26",
      "evidence": "checked",
      "span": { "start": 78 }
    },
    {
      "id": "nameref:named_args_helper::combine@87",
      "kind": "value",
      "from": "fn:named_args_helper::combine",
      "name": "scale",
      "target_kind": "binding",
      "target_id": "binding:fn:named_args_helper::combine:1:scale@38",
      "evidence": "checked",
      "span": { "start": 87 }
    },
    {
      "id": "nameref:named_args_main::local@76",
      "kind": "value",
      "from": "fn:named_args_main::local",
      "name": "left",
      "target_kind": "binding",
      "target_id": "binding:fn:named_args_main::local:1:left@33",
      "evidence": "checked",
      "span": { "start": 76 }
    },
    {
      "id": "nameref:named_args_main::local@83",
      "kind": "value",
      "from": "fn:named_args_main::local",
      "name": "right",
      "target_kind": "binding",
      "target_id": "binding:fn:named_args_main::local:1:right@44",
      "evidence": "checked",
      "span": { "start": 83 }
    },
    {
      "id": "nameref:named_args_main::main@131",
      "kind": "call",
      "from": "fn:named_args_main::main",
      "name": "local",
      "target_kind": "function",
      "target_id": "fn:named_args_main::local",
      "evidence": "checked",
      "span": { "start": 131 }
    },
    {
      "id": "nameref:named_args_main::main@168",
      "kind": "call",
      "from": "fn:named_args_main::main",
      "name": "combine",
      "target_kind": "function",
      "target_id": "fn:named_args_helper::combine",
      "evidence": "checked",
      "span": { "start": 168 }
    },
    {
      "id": "nameref:named_args_main::main@194",
      "kind": "value",
      "from": "fn:named_args_main::main",
      "name": "subtotal",
      "target_kind": "binding",
      "target_id": "binding:fn:named_args_main::main:1:subtotal@120",
      "evidence": "checked",
      "span": { "start": 194 }
    },
    {
      "id": "arglabel:named_args_main::main@147",
      "kind": "argument_label",
      "from": "fn:named_args_main::main",
      "name": "left",
      "target_kind": "binding",
      "target_id": "binding:fn:named_args_main::local:1:left@33",
      "evidence": "checked",
      "span": { "start": 147 }
    },
    {
      "id": "arglabel:named_args_main::main@137",
      "kind": "argument_label",
      "from": "fn:named_args_main::main",
      "name": "right",
      "target_kind": "binding",
      "target_id": "binding:fn:named_args_main::local:1:right@44",
      "evidence": "checked",
      "span": { "start": 137 }
    },
    {
      "id": "arglabel:named_args_main::main@204",
      "kind": "argument_label",
      "from": "fn:named_args_main::main",
      "name": "left",
      "target_kind": "binding",
      "target_id": "binding:fn:named_args_helper::combine:1:left@15",
      "evidence": "checked",
      "span": { "start": 204 }
    },
    {
      "id": "arglabel:named_args_main::main@187",
      "kind": "argument_label",
      "from": "fn:named_args_main::main",
      "name": "right",
      "target_kind": "binding",
      "target_id": "binding:fn:named_args_helper::combine:1:right@26",
      "evidence": "checked",
      "span": { "start": 187 }
    },
    {
      "id": "arglabel:named_args_main::main@176",
      "kind": "argument_label",
      "from": "fn:named_args_main::main",
      "name": "scale",
      "target_kind": "binding",
      "target_id": "binding:fn:named_args_helper::combine:1:scale@38",
      "evidence": "checked",
      "span": { "start": 176 }
    }
  ],
  "call_graph": [
    {
      "caller": "fn:named_args_main::main",
      "callee": "fn:named_args_main::local",
      "call_site": "call:named_args_main::main@131",
      "evidence": "checked"
    },
    {
      "caller": "fn:named_args_main::main",
      "callee": "fn:named_args_helper::combine",
      "call_site": "call:named_args_main::main@168",
      "evidence": "checked"
    }
  ]
}
