{
  "version": 2,
  "command": "facts",
  "module": "main",
  "identity_scheme": "nauqtype.semantic.v1",
  "summary": {
    "modules": 1,
    "definitions": 5,
    "references": 11,
    "call_edges": 1
  },
  "modules": [
    {
      "id": "module:main",
      "name": "main"
    }
  ],
  "definitions": [
    {
      "id": "fn:main::apply",
      "kind": "function",
      "module": "main",
      "name": "apply",
      "public": true,
      "evidence": "declared",
      "span": { "start": 7 }
    },
    {
      "id": "fn:main::main",
      "kind": "function",
      "module": "main",
      "name": "main",
      "public": true,
      "evidence": "declared",
      "span": { "start": 160 }
    },
    {
      "id": "binding:fn:main::apply:1:value@13",
      "kind": "param",
      "module": "main",
      "owner": "fn:main::apply",
      "name": "value",
      "scope_id": 1,
      "evidence": "checked",
      "span": { "start": 13 }
    },
    {
      "id": "binding:fn:main::apply:1:bonus@25",
      "kind": "param",
      "module": "main",
      "owner": "fn:main::apply",
      "name": "bonus",
      "scope_id": 1,
      "evidence": "checked",
      "span": { "start": 25 }
    },
    {
      "id": "binding:fn:main::main:1:value@289",
      "kind": "local",
      "module": "main",
      "owner": "fn:main::main",
      "name": "value",
      "scope_id": 1,
      "evidence": "checked",
      "span": { "start": 289 }
    }
  ],
  "references": [
    {
      "id": "typeref:main::apply@20",
      "kind": "param_type",
      "from": "apply",
      "name": "i32",
      "target_kind": "builtin_type",
      "target_id": "builtin-type:i32",
      "evidence": "builtin",
      "span": { "start": 20 }
    },
    {
      "id": "typeref:main::apply@32",
      "kind": "param_type",
      "from": "apply",
      "name": "i32",
      "target_kind": "builtin_type",
      "target_id": "builtin-type:i32",
      "evidence": "builtin",
      "span": { "start": 32 }
    },
    {
      "id": "typeref:main::apply@40",
      "kind": "return_type",
      "from": "apply",
      "name": "i32",
      "target_kind": "builtin_type",
      "target_id": "builtin-type:i32",
      "evidence": "builtin",
      "span": { "start": 40 }
    },
    {
      "id": "typeref:main::main@170",
      "kind": "return_type",
      "from": "main",
      "name": "i32",
      "target_kind": "builtin_type",
      "target_id": "builtin-type:i32",
      "evidence": "builtin",
      "span": { "start": 170 }
    },
    {
      "id": "typeref:main::main@296",
      "kind": "local_annotation",
      "from": "main",
      "name": "i32",
      "target_kind": "builtin_type",
      "target_id": "builtin-type:i32",
      "evidence": "builtin",
      "span": { "start": 296 }
    },
    {
      "id": "nameref:main::apply@135",
      "kind": "value",
      "from": "fn:main::apply",
      "name": "value",
      "target_kind": "binding",
      "target_id": "binding:fn:main::apply:1:value@13",
      "evidence": "checked",
      "span": { "start": 135 }
    },
    {
      "id": "nameref:main::apply@143",
      "kind": "value",
      "from": "fn:main::apply",
      "name": "bonus",
      "target_kind": "binding",
      "target_id": "binding:fn:main::apply:1:bonus@25",
      "evidence": "checked",
      "span": { "start": 143 }
    },
    {
      "id": "nameref:main::main@302",
      "kind": "call",
      "from": "fn:main::main",
      "name": "apply",
      "target_kind": "function",
      "target_id": "fn:main::apply",
      "evidence": "checked",
      "span": { "start": 302 }
    },
    {
      "id": "nameref:main::main@341",
      "kind": "value",
      "from": "fn:main::main",
      "name": "value",
      "target_kind": "binding",
      "target_id": "binding:fn:main::main:1:value@289",
      "evidence": "checked",
      "span": { "start": 341 }
    },
    {
      "id": "arglabel:main::main@318",
      "kind": "argument_label",
      "from": "fn:main::main",
      "name": "value",
      "target_kind": "binding",
      "target_id": "binding:fn:main::apply:1:value@13",
      "evidence": "checked",
      "span": { "start": 318 }
    },
    {
      "id": "arglabel:main::main@308",
      "kind": "argument_label",
      "from": "fn:main::main",
      "name": "bonus",
      "target_kind": "binding",
      "target_id": "binding:fn:main::apply:1:bonus@25",
      "evidence": "checked",
      "span": { "start": 308 }
    }
  ],
  "call_graph": [
    {
      "caller": "fn:main::main",
      "callee": "fn:main::apply",
      "call_site": "call:main::main@302",
      "evidence": "checked"
    }
  ]
}
